English Translation,Standard Bangla Lanuguage,Romanized Bangla,Chittagong Language,Romanized Chittagong Language,Sylhet Language,Romanized Sylhet Language
I caught a cold,আমার ঠান্ডা লেগেছে,Amar thanda legeche,আর তুন তান্দা লাইগ্গে ,Ar tun tanda laigge,আমার ঠান্ডা লাগছে,Amar ṭhanḍa lagse
Caught a cold,ঠান্ডা লেগেছে,Thanda legeche,তান্দা লাইগ্গে ,Tanda laigge,ঠান্ডা লাগছে,Ṭhanḍa lagse
I went abroad,আমি বিদেশে গেছিলাম,Ami bideshe gechilam,আই বিদেশত গেইলাম ,Ai bideshot geilam,আমি বিদেশ গেছলাম,Ami bidesh geslam
Went abroad,বিদেশে গেছিলাম,Bideshe gechilam,বিদেশত গেইলাম ,Bideshot geilam,বিদেশ গেছলাম,Bidesh geslam
Take me there,আমাকে ওখানে নিয়ে চলুন,Amake okhane niye cholun,আরে ঐইন্দি লই জো,Are oindi loi zo,আমারে হন লইগা যাউকগা ,Amare hon loiga zaukga
Take there,ওখানে নিয়ে চলুন,Okhane niye cholun,ঐইন্দি লই জো,Oindi loi zo,হন লইগা যাউকগা ,Hon loiga zaukga
Take,নিয়ে চলুন,Niye cholun,লই জো,Loi zo,লইগা যাউকগা ,Loiga zaukga
Shimu likes white,শিমুর সাদা রং পছন্দ ,Shimur shada rong pochondo,শিমুর সাদা রং পছন্দ ,Shimur sada rong posondo,শিমুর সাদা রং পছন্দ ,Shimur shada rong posondo
Shimu likes blue,শিমুর নীল রং পছন্দ ,Shimur neel rong pochondo,শিমুর নীল রং পছন্দ ,Shimur nil rong posondo,শিমুর নীল রং পছন্দ ,Shimur nil rong posondo
Shimu likes purple,শিমুর বেগুনি রং পছন্দ ,Shimur beguni rong pochondo,শিমুর বেগুনি রং পছন্দ ,Shimur beguni rong posondo,শিমুর বেগুনি রং পছন্দ ,Shimur beguni rong posondo
Don’t call,ডাকবেন না,Dakben na,নো ডাইক্কো,No daikko,ডাকবা না,Ḍakba na
Call me,আমাকে ডাকবেন ,Amake dakben,আরে ডাইক্কো,Are daikko,আমারে ডাকবা ,Amare ḍakba
I like apples,আমি আপেল পছন্দ করি,Ami apple pochondo kori,আই আফেল দেহিত ফারি,Ai afel dehit fari,আমি আপেল ভালা ফাই,Ami afel bala fai
Like apples,আপেল পছন্দ করি,Apple pochondo kori,আফেল দেহিত ফারি,Afel dehit fari,আপেল ভালা ফাই,Afel bala fai
It’s over,শেষ হয়ে গেছে,Shesh hoye geche,শেষ ওই গিয়োই ,Shesh oi giyoi,ফুরাই গেছে,Furai gese
Is over,হয়ে গেছে,Hoye geche,ওই গিয়োই ,Oi giyoi,গেছে,Gese
Time’s up,সময় শেষ,Shomoy shesh,সময় শেষ ,Shomoy shesh,সময় ফুরাই,Shomoy furai
We will wait,আমরা অপেক্ষা করবো ,Amra opekkha korbo,আরা অফেক্ষা কইজ্জুম ,Ara ofekkha koijjum,আমরা উবাইমু নে,Amra ubaimu ne
Will wait,অপেক্ষা করবো ,Opekkha korbo,অফেক্ষা কইজ্জুম ,Ofekkha koijjum,উবাইমু নে,Ubaimu ne
He stood up,তিনি উঠে দাঁড়ালেন,Tini uthe daralen,এবা উথি গিয়োয়,Eba uthi giyoi,তাইন উঠিয়া দাড়াইলা ,Tain uṭhiya daṛaila
Stood up,উঠে দাঁড়ালেন,Uthe daralen,উথি গিয়োয়,Uthi giyoi,উঠিয়া দাড়াইলা ,Uṭhiya daṛaila
He stood,তিনি  দাঁড়ালেন,Tini daralen,এবা গিয়োয়,Eba giyoi,তাইন দাড়াইলা ,Tain daṛaila
I like blue,আমার নীল রং পছন্দ ,Amar neel rong pochondo,আমার নীল রং পছন্দ ,Amar nil rong posondo,আমার নীল রং পছন্দ ,Amar nil rong posondo
I like purple,আমার বেগুনি রং পছন্দ ,Amar beguni rong pochondo,আমার বেগুনি রং পছন্দ ,Amar beguni rong posondo,আমার বেগুনি রং পছন্দ ,Amar beguni rong posondo
I like pink,আমার গোলাপি রং পছন্দ ,Amar golapi rong pochondo,আমার গোলাপি রং পছন্দ ,Amar gulapi rong posondo,আমার গোলাপি রং পছন্দ ,Amar gulafi rong posondo
I like sky blue,আমার আকাশী রং পছন্দ ,Amar akashi rong pochondo,আমার আকাশী রং পছন্দ ,Amar akashi rong posondo,আমার আকাশী রং পছন্দ ,Amar akashi rong posondo
I like gray,আমার ধূসর রং পছন্দ ,Amar dhusor rong pochondo,আমার ধূসর রং পছন্দ ,Amar dhushor rong posondo,আমার ধূসর রং পছন্দ ,Amar dhushor rong posondo
I like maroon,আমার মেরুন রং পছন্দ ,Amar merun rong pochondo,আমার মেরুন রং পছন্দ ,Amar merun rong posondo,আমার মেরুন রং পছন্দ ,Amar merun rong posondo
I have breakfast and go to school,আমি নাস্তা করে স্কুলে যাই ,Ami nasta kore school e jai,আই নাস্তা হরিয়ার স্কুলত যাই না,Ai nasta horiyar schoolot zai na,আমি নাস্তা খাইয়া বাদে স্কুল ও যাই না,Ami nasta khaiya bade skul o zai na
I don’t have breakfast and go to school in the morning,আমি সকালে নাস্তা করে স্কুলে যাই না,Ami shokale nasta kore school e jai na,আই সকালট নাস্তা হরিয়ার স্কুলত যাই না,Ai sokalot nasta horiyar schoolot zai na,আমি সোকাইলকু নাস্তা খাইয়া বাদে স্কুল ও যাই না,Ami sokailku nasta khaiya bade skul o zai na
Don’t have breakfast and go to school in the morning,সকালে নাস্তা করে স্কুলে যাই না,Shokale nasta kore school e jai na,সকালট নাস্তা হরিয়ার স্কুলত যাই না,Sokalot nasta horiyar schoolot zai na,সোকাইলকু নাস্তা খাইয়া বাদে স্কুল ও যাই না,Sokailku nasta khaiya bade skul o zai na
Don’t have breakfast and go to school,নাস্তা করে স্কুলে যাই না,Nasta kore school e jai na,নাস্তা হরিয়ার স্কুলত যাই না,Nasta horiyar schoolot zai na,নাস্তা খাইয়া বাদে স্কুল ও যাই না,Nasta khaiya bade skul o zai na
Don’t go to school,স্কুলে যাই না,School e jai na,স্কুলত যাই না,Schoolot zai na,স্কুল ও যাই না,Skul o zai na
I don’t have breakfast and go to school,আমি নাস্তা করে স্কুলে যাই না,Ami nasta kore school e jai na,আই নাস্তা হরিয়ার স্কুলত যাই না,Ai nasta horiyar schoolot zai na,আমি নাস্তা খাইয়া বাদে স্কুল ও যাই না,Ami nasta khaiya bade skul o zai na
He will go abroad next month,সে পরের মাসে বিদেশ চলে যাবে,She porer mashe bidesh chole jabe,ইতে ফরের মাশত বিদেশ জৈব গৌ ,Ite forer mashot bidesh zoibo gou,তাই বাদের মাশও বিদেশ যাইবো গি,Tai bader masho bidesh zaibo gi
Will go abroad next month,পরের মাসে বিদেশ চলে যাবে,Porer mashe bidesh chole jabe,ফরের মাশত বিদেশ জৈব গৌ ,Forer mashot bidesh zoibo gou,বাদের মাশও বিদেশ যাইবো গি,Bader masho bidesh zaibo gi
He will go abroad,সে বিদেশ চলে যাবে,She bidesh chole jabe,ইতে বিদেশ জৈব গৌ ,Ite bidesh zoibo gou,তাই বিদেশ যাইবো গি,Tai bidesh zaibo gi
Will go abroad,বিদেশ চলে যাবে,Bidesh chole jabe,বিদেশ জৈব গৌ ,Bidesh zoibo gou,বিদেশ যাইবো গি,Bidesh zaibo gi
Will go,চলে যাবে,Chole jabe,জৈব গৌ ,Zoibo gou,যাইবো গি,Zaibo gi
The girl is very rude,মেয়েটি খুবই বেয়াদব ,Meyeti khub-i beyadob,বেদি ইবা বেশি বেয়াদব,Bedi iba beshi beyadob,ফুরিতা যে বেয়াদপ ,Furita ze beyadob
Very rude,খুবই বেয়াদব ,Khub-i beyadob,বেশি বেয়াদব,Beshi beyadob,যে বেয়াদপ ,Ze beyadob
The girl is rude,মেয়েটি বেয়াদব ,Meyeti beyadob,বেদি বেয়াদব,Bedi beyadob,যে বেয়াদপ ,Ze beyadob
He is very rude,সে খুবই বেয়াদব ,She khub-i beyadob,ইতে ইবা বেশি বেয়াদব,Ite iba beshi beyadob,তাই যে বেয়াদপ ,Tai ze beyadob
He is rude,সে বেয়াদব ,She beyadob,ইতে বেয়াদব,Ite beyadob,তাই বেয়াদপ ,Tai beyadob
The boy is walking along the road,ছেলেটি রাস্তা দিয়ে হেটে যাচ্ছে,Cheleti rasta diye hete jacche,ফুয়া ইবা রাস্তা দিয়েরে হাথি যার গোয় ,Fua iba rasta diyere hathi zaar goy,ফুয়াগু রাস্তা বায়দি হাটিয়া যাইরো ,Fuagu rasta baydi haṭiya zairo
Walking along the road,রাস্তা দিয়ে হেটে যাচ্ছে,Rasta diye hete jacche,রাস্তা দিয়েরে হাথি যার গোয় ,Rasta diyere hathi zaar goy,রাস্তা বায়দি হাটিয়া যাইরো ,Rasta baydi haṭiya zairo
Walking,হেটে যাচ্ছে,Hete jacche,হাথি যার গোয় ,Hathi zaar goy,হাটিয়া যাইরো ,Haṭiya zairo
The boy is walking,ছেলেটি হেটে যাচ্ছে,Cheleti hete jacche,ফুয়া ইবা হাথি যার গোয় ,Fua iba hathi zaar goy,ফুয়াগু হাটিয়া যাইরো ,Fuagu haṭiya zairo
The boy is going along the road,ছেলেটি রাস্তা দিয়ে যাচ্ছে,Cheleti rasta diye jacche,ফুয়া ইবা রাস্তা দিয়েরে যার গোয় ,Fua iba rasta diyere zaar goy,ফুয়াগু রাস্তা বায়দি যাইরো ,Fuagu rasta baydi zairo
The girl came to meet me wearing a red saree,মেয়েটি লাল রঙের শাড়ি পরে আমার সাথে দেখা করতে এসেছিল,Meyeti laal ronger shari pore amar shathe dekha korte eshechilo,মৈফিয়াইবা লাল রঙের শাড়ি ফরি আর লই দেহা গৈর তো আইসে ,Moifiaiba lal ronger shari fori ar loi deha goir to aise,ফুরিতায় লাল রংগর শারি পিন্দিয়া মর লগে দেখা করাত আইছিল,Furitay lal rongor shari pindiya mor loge deka korat aisil
The girl came to meet me wearing a saree,মেয়েটি শাড়ি পরে আমার সাথে দেখা করতে এসেছিল,Meyeti shari pore amar shathe dekha korte eshechilo,মৈফিয়াইবা শাড়ি ফরি আর লই দেহা গৈর তো আইসে ,Moifiaiba shari fori ar loi deha goir to aise,ফুরিতায় শারি পিন্দিয়া মর লগে দেখা করাত আইছিল,Furitay shari pindiya mor loge deka korat aisil
Red saree, লাল রঙের শাড়ি,Laal ronger shari,লাল রঙের শাড়ি,Lal ronger shari, লাল রংগর শারি,Lal rongor shari
Came to meet me,আমার সাথে দেখা করতে এসেছিল,Amar shathe dekha korte eshechilo,আর লই দেহা গৈর তো আইসে,Ar loi deha goir to aise,মর লগে দেখা করাত আইছিল,Mor loge deka korat aisil
Came to meet,দেখা করতে এসেছিল,Dekha korte eshechilo,দেহা গৈর তো আইসে,Deha goir to aise,দেখা করাত আইছিল,Deka korat aisil
The girl came to meet,মেয়েটি দেখা করতে এসেছিল,Meyeti dekha korte eshechilo,মৈফিয়াইবা দেহা গৈর তো আইসে ,Moifiaiba deha goir to aise,ফুরিতায় দেখা করাত আইছিল,Furitay deka korat aisil
The girl came to meet me,মেয়েটি আমার সাথে দেখা করতে এসেছিল,Meyeti amar shathe dekha korte eshechilo,মৈফিয়াইবা আর লই দেহা গৈর তো আইসে ,Moifiaiba ar loi deha goir to aise,ফুরিতায় মর লগে দেখা করাত আইছিল,Furitay mor loge deka korat aisil
Wearing a saree came to meet me,শাড়ি পরে আমার সাথে দেখা করতে এসেছিল,Shari pore amar shathe dekha korte eshechilo,শাড়ি ফরি আর লই দেহা গৈর তো আইসে ,Shari fori ar loi deha goir to aise,শারি পিন্দিয়া মর লগে দেখা করাত আইছিল,Shari pindiya mor loge deka korat aisil
Came to meet with me,আমার সাথে দেখা ,Amar shathe dekha,আর লই দেহা,Ar loi deha,মর লগে দেখা ,Mor loge deka
Wearing a red saree met with me,লাল রঙের শাড়ি পরে আমার সাথে দেখা ,Laal ronger shari pore amar shathe dekha,লাল রঙের শাড়ি ফরি আর লই দেহা ,Lal ronger shari fori ar loi deha,লাল রংগর শারি পিন্দিয়া মর লগে দেখা ,Lal rongor shari pindiya mor loge deka
Mom was right that day,মা সেদিন ঠিকই বলেছিল,Ma shedin thik-i bolechilo,মা ওইদিন ঠিক হতাই হইলো,Ma oidin thik hotai hoilo,আম্মায় হেদিন থিক কথাউ কইছলা,Ammay hedin thik kothau koisla
Mom was right,মা ঠিকই বলেছিল,Ma thik-i bolechilo,মা ঠিক হতাই হইলো,Ma thik hotai hoilo,আম্মায় থিক কথাউ কইছলা,Ammay thik kothau koisla
Was right,ঠিকই বলেছিল,Thik-i bolechilo,ঠিক হতাই হইলো,Thik hotai hoilo,থিক কথাউ কইছলা,Thik kothau koisla
I will go there,আমি ওখানে যাব,Ami okhane jabo,আমি এন্ডে যাইয়ুম ,Ami ende zaiyum,আমি ওখানো যাইমু ,Ami okhano zaimu
Won’t go that way,ওদিকে যাব না,Odike jabo na,ইক্কে নযাইয়ুম ,Ikke nozaiyum,ওবায় যাইতাম না,Obay zaitam na
Will go that way,ওদিকে যাব,Odike jabo,ইক্কে যাইয়ুম ,Ikke zaiyum,ওবায় যাইমু,Obay zaimu
We lost,আমরা হেরে গেছি,Amra here gechi,আই আরি গিয়ি ,Ai ari giyi,আমরা হারি গেছি,Amra hari gesi
Lost,হেরে গেছি,Here gechi,আরি গিয়ি ,Ari giyi,হারি গেছি,Hari gesi
We had lost,আমরা হেরে গেছিলাম,Amra here gechilam,আরা হারি গিয়ি ,Ara hari giyi,আমরা হারি গেছিলাম,Amra hari gesilam
Had lost,হেরে গেছিলাম,Here gechilam,হারি গিয়ি ,Hari giyi,হারি গেছিলাম,Hari gesilam
We went,আমরা গেছিলাম,Amra gechilam,আরা গিয়ি ,Ara giyi,আমরা গেছিলাম,Amra gesilam
Who ate the mango?,আমটি কে খেয়েছিল?,Amti ke kheyechilo?,আম ইবা হন হাইয়ে,Aam iba hon haiye,আম ওগু কে খাইছিল?,Aam ogu ke khaisilo?
Who ate it?,কে খেয়েছিল?,Ke kheyechilo?,ইবা হন হাইয়ে,Iba hon haiye,কে খাইছিল?,Ke khaisilo?
Ate the mango,আমটি খেয়েছিল,Amti kheyechilo,আম হাইয়ে,Aam haiye,আম খাইছিল,Aam khaisilo
I am here,আমি আছি,Ami achi,আই আছি,Ai asi,আমি আছি,Ami asi
Trust me,আমাকে বিশ্বাস করো,Amake bisshash koro,আরে বিশ্বাস গোরো ,Are bishwas goro,আমারে বিশ্বাস করো ,Amare bishwash koro
Trust,বিশ্বাস করো,Bisshash koro,বিশ্বাস গোরো ,Bishwas goro,বিশ্বাস করো,Bishwash koro
"On Friday, we went",শুক্রবার আমরা গেছিলাম ,Shukrobar amra gechilam,শুক্রবার আরা গিয়ি ,Shukrobar ara giyi,শুক্রবার আমরা গেছিলাম,Shukrobar amra gesilam
"On Friday, mom was right",শুক্রবার মা সেদিন ঠিকই বলেছিল,Shukrobar ma shedin thik-i bolechilo,শুক্রবার মা ওইদিন ঠিক হতাই হইলো,Shukrobar ma oidin thik hotai hoilo,শুক্রবার আম্মায় হেদিন থিক কথাউ কইছলা,Shukrobar ammay hedin thik kotau koisola
My car was stolen yesterday,আমার গাড়িটা গতকাল চুরি হয়ে গেছে,Amar gari-ta gotokal churi hoye geche,আর গাড়িয়ান গতো হালিয়া চুরি ওইয়ে,Ar garian goto haliya suri oiye,আময়ার গাড়ি ওগু গতকাইল চুরি অই গেছে,Amrar gari ogu gotokail suri oi gese
There was a theft at my house yesterday,আমার বাসায় গতকাল চুরি হয়েছে,Amar bashay gotokal churi hoyeche,আর ঘরত গতো হালিয়া রাইত ওত চুরি ওইয়ে,Ar ghorot goto haliya rait ot suri oiye,আমার বাসাত গতকাইল চুরি অই গেছে,Amar bashat gotokail suri oi gese
There was a theft at the house yesterday,বাসায় গতকাল চুরি হয়েছে,Bashay gotokal churi hoyeche,ঘরত গতো হালিয়া রাইত ওত চুরি ওইয়ে,Ghorot goto haliya rait ot suri oiye,বাসাত গতকাইল চুরি অই গেছে,Bashat gotokail suri oi gese
Theft happened yesterday,গতকাল চুরি হয়েছে,Gotokal churi hoyeche,গতো হালিয়া রাইত ওত চুরি ওইয়ে,Goto haliya rait ot suri oiye,গতকাইল চুরি অই গেছে,Gotokail suri oi gese
My car is red,আমার গাডির রঙ লাল,Amar garir rong laal,আর গাড়ির রঙ লাল,Ar garir rong lal,আমার গাড়ি ওগুর রঙ অইল লাল,Amar gari ogur rong oil lal
Car is red,গাডির রঙ লাল,Garir rong laal,গাড়ির রঙ লাল,Garir rong lal,গাড়ি ওগুর রঙ অইল লাল,Gari ogur rong oil lal
Should speak in simple language,সহজ ভাষায় কথা বলা উচিৎ,Shohoj bhashay kotha bola uchit,সহজ ভাষাত হতা হউয়া উচিৎ,Sohoj bhashat hota houa uchit,সহজ ভাষায় মাতা উচিৎ,Shohoz bashay mata usit
I am with you,আমি আপনার সংগে আছি,Ami apnar shonge achi,আই অনর ফয়ারে আছি,Ai onor foyare asi,আমি আফনার লগে আছি,Ami afnar loge asi
With you,আপনার সংগে আছি,Apnar shonge achi,অনর ফয়ারে আছি,Onor foyare asi,আফনার লগে আছি,Afnar loge asi
I am with,সংগে আছি,Shonge achi,ফয়ারে আছি,Foyare asi,লগে আছি,Loge asi
My father lives abroad,আমার আব্বু বিদেশ থাকে,Amar abbu bidesh thake,আর আব্বু বিদেশ তাকে,Ar abbu bidesh thake,আমার আব্বা বিদেশ থাকোইন,Amar abba bidesh takoin
Father lives abroad,আব্বু বিদেশ থাকে,Abbu bidesh thake,আব্বু বিদেশ তাকে,Abbu bidesh thake,আব্বা বিদেশ থাকোইন,Abba bidesh takoin
Lives abroad,বিদেশ থাকে,Bidesh thake,বিদেশ তাকে,Bidesh thake,বিদেশ থাকোইন,Bidesh takoin
My elder sister loves me very much,আমার বড় বোন আমাকে অনেক ভালোবাসে,Amar boro bon amake onek bhalobashe,আর বড় বইন আরে বহুত ভালোবাসে,Ar boro boin are bohut balobashe,আমার বর বইনে আমারে খুব ভালা ফায়,Amar bor boine amare khub bala fay
Elder sister loves me very much,বড় বোন আমাকে অনেক ভালোবাসে,Boro bon amake onek bhalobashe,বড় বইন আরে বহুত ভালোবাসে,Boro boin are bohut balobashe,বর বইনে আমারে খুব ভালা ফায়,Bor boine amare khub bala fay
Sister loves me very much,বোন আমাকে অনেক ভালোবাসে,Bon amake onek bhalobashe,বইন আরে বহুত ভালোবাসে,Boin are bohut balobashe,বইনে আমারে খুব ভালা ফায়,Boine amare khub bala fay
Loves me very much,আমাকে অনেক ভালোবাসে,Amake onek bhalobashe,আরে বহুত ভালোবাসে,Are bohut balobashe,আমারে খুব ভালা ফায়,Amare khub bala fay
My sister loves me very much,আমার বোন আমাকে অনেক ভালোবাসে,Amar bon amake onek bhalobashe,আর বইন আরে বহুত ভালোবাসে,Ar boin are bohut balobashe,আমার বইনে আমারে খুব ভালা ফায়,Amar boine amare khub bala fay
I love my elder sister very much,আমার বর বোনকে আমি অনেক ভালোবাসি,Amar boro bonke ami onek bhalobashi,আর বড় বইঙ্কে আই বহুত ভালোবাসি,Ar boro boinke ai bohut balobashi,আমার বড় বইনরে আমি খুব ভালা ফাই,Amar boro boinre ami khub bala fai
Love elder sister very much,বর বোনকে আমি অনেক ভালোবাসি,Boro bonke ami onek bhalobashi,বড় বইঙ্কে আই বহুত ভালোবাসি,Boro boinke ai bohut balobashi,বড় বইনরে আমি খুব ভালা ফাই,Boro boinre ami khub bala fai
Love sister very much,বোনকে আমি অনেক ভালোবাসি,Bonke ami onek bhalobashi,বইঙ্কে আই বহুত ভালোবাসি,Boinke ai bohut balobashi,বইনরে আমি খুব ভালা ফাই,Boinre ami khub bala fai
Has your elder sister gotten married?,আপনার বড় বোনের কি বিয়ে হয়ে গেছে?,Apnar boro boner ki biye hoye geche?,অনর বড় বইনের কি বিয়া ওই গেইয়ু নি?,Onor boro boiner ki biya oi geiyu ni?,আফনার বড় বইনের কিতা বিয়া অই গেছে নি?,Afnar boro boiner kita biya oi gese ni?
Has elder sister gotten married?,বড় বোনের কি বিয়ে হয়ে গেছে?,Boro boner ki biye hoye geche?,বড় বইনের কি বিয়া ওই গেইয়ু নি?,Boro boiner ki biya oi geiyu ni?,বড় বইনের কিতা বিয়া অই গেছে নি?,Boro boiner kita biya oi gese ni?
Has sister gotten married?,বোনের কি বিয়ে হয়ে গেছে?,Boner ki biye hoye geche?,বইনের কি বিয়া ওই গেইয়ু নি?,Boiner ki biya oi geiyu ni?,বইনের কিতা বিয়া অই গেছে নি?,Boiner kita biya oi gese ni?
Gotten married?,কি বিয়ে হয়ে গেছে?,Ki biye hoye geche?,কি বিয়া ওই গেইয়ু নি?,Ki biya oi geiyu ni?,কিতা বিয়া অই গেছে নি?,Kita biya oi gese ni?
