English Translation,Standard Bangla Lanuguage,Romanized Bangla,Chittagong Language,Romanized Chittagong Language,Sylhet Language,Romanized Sylhet Language
I have breakfast and go to school in the morning.,সকালে নাস্তা করে স্কুলে যাই ,Shokale nasta kore school e jai,সকালট নাস্তা হরিয়ার স্কুলত যাই ,Sokalot nasta horiyar schoolot zai,সোকাইলকু নাস্তা খাইয়া বাদে স্কুল ও যাই ,Sokailku nasta khaiya bade skul o zai
Have breakfast and go to school.,নাস্তা করে স্কুলে যাই ,Nasta kore school e jai,নাস্তা হরিয়ার স্কুলত যাই ,Nasta horiyar schoolot zai,নাস্তা খাইয়া বাদে স্কুল ও যাই ,Nasta khaiya bade skul o zai
Go to school.,স্কুলে যাই ,School e jai,স্কুলত যাই ,Schoolot zai,স্কুল ও যাই ,Skul o zai
I have breakfast and go to school.,আমি নাস্তা করে স্কুলে যাই ,Ami nasta kore school e jai,আই নাস্তা হরিয়ার স্কুলত যাই ,Ai nasta horiyar schoolot zai,আমি নাস্তা খাইয়া বাদে স্কুল ও যাই ,Ami nasta khaiya bade skul o zai
I don’t feel like eating anything in the morning.,আমার সকালে কিছু খেতে ভালো লাগে না,Amar shokale kichu khete bhalo lage na,আরে সকালত হিছু খাইত গম না লাগে,Are sokalot hisu hait gom na lage,আমার সকালকু কুন্টা খাইতে ভালা লাগে না,Amar sokalku kunṭa khaite bala lage na
I don’t feel like eating anything in the morning.,সকালে কিছু খেতে ভালো লাগে না,Shokale kichu khete bhalo lage na,সকালত হিছু খাইত গম না লাগে,Sokalot hisu hait gom na lage,সকালকু কুন্টা খাইতে ভালা লাগে না,Sokalku kunṭa khaite bala lage na
Don’t feel like eating anything.,কিছু খেতে ভালো লাগে না,Kichu khete bhalo lage na,হিছু খাইত গম না লাগে,Hisu hait gom na lage,কুন্টা খাইতে ভালা লাগে না,Kunṭa khaite bala lage na
Don’t feel like eating.,খেতে ভালো লাগে না,Khete bhalo lage na,খাইত গম না লাগে,Hait gom na lage,খাইতে ভালা লাগে না,Khaite bala lage na
Don’t feel like it.,ভালো লাগে না,Bhalo lage na,গম না লাগে,Gom na lage,ভালা লাগে না,Bala lage na
Don’t like it.,লাগে না,Lage na,না লাগে,Na lage,লাগে না,Lage na
I don’t feel like eating anything.,আমার কিছু খেতে ভালো লাগে না,Amar kichu khete bhalo lage na,আরে হিছু খাইত গম লাগে,Are hisu hait gom lage,আমার কুন্টা খাইতে ভালা লাগে ,Amar kunṭa khaite bala lage
I don’t feel like eating.,আমার খেতে ভালো লাগে না,Amar khete bhalo lage na,আরে খাইত গম লাগে,Are hait gom lage,আমার কুন্টা খাইতে ভালা লাগে ,Amar kunṭa khaite bala lage
I don’t like anything.,আমার কিছু ভালো লাগে না,Amar kichu bhalo lage na,আরে হিছু গম লাগে,Are hisu gom lage,আমার কুন্টা ভালা লাগে ,Amar kunṭa bala lage
I don’t like it.,আমার ভালো লাগে না,Amar bhalo lage na,আরে গম লাগে,Are gom lage,আমার খাইতে ভালা লাগে ,Amar khaite bala lage
I feel like eating something in the morning.,আমার সকালে কিছু খেতে ভালো লাগে ,Amar shokale kichu khete bhalo lage,আরে সকালত হিছু খাইত গম লাগে,Are sokalot hisu hait gom lage,আমার সকালকু কুন্টা খাইতে ভালা লাগে,Amar sokalku kunṭa khaite bala lage
I feel like eating something in the morning.,সকালে কিছু খেতে ভালো লাগে,Shokale kichu khete bhalo lage,সকালত হিছু খাইত গম লাগে,Sokalot hisu hait gom lage,সকালকু কুন্টা খাইতে ভালা লাগে ,Sokalku kunṭa khaite bala lage
Feel like eating something.,কিছু খেতে ভালো লাগে ,Kichu khete bhalo lage,হিছু খাইত গম লাগে,Hisu hait gom lage,কুন্টা খাইতে ভালা লাগে ,Kunṭa khaite bala lage
Feel like eating.,খেতে ভালো লাগে ,Khete bhalo lage,খাইত গম লাগে,Hait gom lage,খাইতে ভালা লাগে ,Khaite bala lage
Like it.,ভালো লাগে ,Bhalo lage,গম লাগে,Gom lage,ভালা লাগে ,Bala lage
I feel like eating something.,আমার কিছু খেতে ভালো লাগে ,Amar kichu khete bhalo lage,আরে হিছু খাইত গম লাগে,Are hisu hait gom lage,আমার কুন্টা খাইতে ভালা লাগে ,Amar kunṭa khaite bala lage
I feel like eating.,আমার খেতে ভালো লাগে ,Amar khete bhalo lage,আরে খাইত গম লাগে,Are hait gom lage,আমার কুন্টা খাইতে ভালা লাগে,Amar kunṭa khaite bala lage
I like something.,আমার কিছু ভালো লাগে ,Amar kichu bhalo lage,আরে হিছু গম লাগে,Are hisu gom lage,আমার কুন্টা ভালা লাগে ,Amar kunṭa bala lage
I like it.,আমার ভালো লাগে ,Amar bhalo lage,আরে গম লাগে,Are gom lage,আমার খাইতে ভালা লাগে ,Amar khaite bala lage
We lost.,আমরা হেরে গেছি,Amra here gechi,আই আরি গিয়ি ,Ai ari giyi,আমরা হারি গেছি,Amra hari gesi
I am fine.,আমি ভাল আছি,Ami bhalo achi,আঁই ভালা আছি,Añi bhala asi,আমি ভালা আছি,Ami bala asi
Fine.,ভাল আছি,Bhalo achi,ভালা আছি,Bhala asi,ভালা আছি,Bala asi
I am not fine.,আমি ভাল নাই,Ami bhalo nai,আঁই ভালা নাই,Añi bhala nai,আমি ভালা নাই,Ami bala nai
How are you?,তুমি কেমন আছ?,Tumi kemon acho?,অনে কেন আছন ?,One ken ason?,তুমি কিলাখান আছ,Tumi kilakhan aso
Not feeling good.,ভাল লাগছে না,Bhalo lagche na,ভালা ন লাগের,Bhala no lager,ভালা লাগের না,Bala lager na
I am not feeling good.,আমার ভাল লাগছে না,Amar bhalo lagche na,আঁত্তে ভালা ন লাগের,Añtte bhala no lager,আমার ভালা লাগের না,Amar bala lager na
I will play cricket.,আমি ক্রিকেট খেলব,Ami cricket khelbo,আঁই কিরকেট খেইল্যম,Añi kirket heillyom,আমি ক্রিকেট খেলমু,Ami cricket khelmu
Will play cricket.,ক্রিকেট খেলব,Cricket khelbo,কিরকেট খেইল্যম,Kirket heillyom,ক্রিকেট খেলুম ,Cricket khelum
Where are you?,তুমি কোথায়?,Tumi kothay?,তুঁই কডে?,Tui kode?,তুমি কই ,Tumi koi
A cat is sitting in front of the door.,একটি বিড়াল দরজার সামনে বসে আছে,Ekti biral dorjar shamne boshe ache,এইগ্গ বিড়াল দরজাত বই আছে,Eigga biral dorzat boi ase,একগু বিলাই দরজার ধারো বৈ রিছে ,Ekgu bilai dorzar dharo boi rise
The cat is sitting in front of the door.,বিড়াল দরজার সামনে বসে আছে,Biral dorjar shamne boshe ache,বিড়াল দরজাত বই আছে,Biral dorzat boi ase,বিলাই দরজার ধারো বৈ রিছে ,Bilai dorzar dharo boi rise
Sitting in front of the door.,দরজার সামনে বসে আছে,Dorjar shamne boshe ache,দরজাত বই আছে,Dorzat boi ase,দরজার ধারো বৈ রিছে ,Dorzar dharo boi rise
Sitting in front.,সামনে বসে আছে,Shamne boshe ache,বই আছে,Boi ase,ধারো বৈ রিছে ,Dharo boi rise
Sitting.,বসে আছে,Boshe ache,বই আছে,Boi ase,বৈ রিছে ,Boi rise
I don’t want to go to work.,আমি কাজে যেতে চাই না,Ami kaaje jete chai na,এই কাজত যাইত ন চাই,Ei kazot zait no sai,আমি কামো যাইতাম চায়না,Ami kamo zaitam sayna
Where are you coming from?,তুমি কোথা থেকে আসছ?,Tumi kotha theke ashcho?,তুঁই কডেত্তুন আইশ্যো ?,Tui kodettun aissho?,তুমি কই থাকি আইছো ,Tumi koi thaki aiso
Where are you coming from?,কোথা থেকে আসছ?,Kotha theke ashcho?,কডেত্তুন আইশ্যো ?,Kodettun aissho?,কই থাকি আইছো ,Koi thaki aiso
Where do you live?,তুমি কোথায় থাক?,Tumi kothay thako?,তুঁই কডে থাহ ?,Tui kode thaho?,তুমি কই থাকো ,Tumi koi thako
Where do you live?,কোথায় থাক?,Kothay thako?,কডে থাহ ?,Kode thaho?,কই থাক ,Koi thak
I am not well.,আমি ভালো নাই,Ami bhalo nai,আই গওম নাই,Ai gom nai,আমি ভালা নাই ,Ami bala nai
How are you?,আপনি কেমন আছেন?,Apni kemon achen?,অনে কেন আছন?,One ken ason?,আফনে কিলাখান আছইন ,Afne kilakhan asoin
How are you?,তুমি কেমন আছো,Tumi kemon acho,তুঁই কেন আছ,Tui ken aso,তুমি কিলাখান আছো,Tumi kilakhan aso
Go somewhere.,কোথাও যাও,Kothao jao,হন্ডে যর,Honde zor,কোনাখানো যাও ,Konakhano zao
Where are you coming from?,তুমি কোথায় থেকে আসছো?,Tumi kothay theke ashcho?,অবা তুয়ারো ঘর হডে?,Oba tuaro ghor hode?,তুমি কই থাকি আইছো,Tumi koi thaki aiso
Where are you coming from?,কোথায় থেকে আসছো?,Kothay theke ashcho?,ঘর হডে?,Ghor hode?,কই থাকি আইছো ,Koi thaki aiso
What do you do?,তুমি কি করো?,Tumi ki koro?,তোঁয়াই কিরর?,Toai kiror?,তুমি কিতা করো?,Tumi kita koro?
Why are you saying that?,কেনো বলতেছেন?,Keno boltechen?,কেআ হন্দে?,Kea honde?,কিতার লাগি কইরায় ,Kitar lagi koiray
What do you do?,কি করো?,Ki koro?,কিরর?,Kiror?,কিতা করো ,Kita koro
My mind is not well.,আমার মন ভালো নেই,Amar mon bhalo nei,আঁর মনত শান্তি নাই,Añr monot shanti nai,আমার মন ভালা নাই ,Amar mon bala nai
Not feeling well.,মন ভালো নেই,Mon bhalo nei,মনত শান্তি নাই,Monot shanti nai,মন ভালা নাই ,Mon bala nai
Where is your home?,আপনাদের বাড়ি কোথায়,Apnader bari kothay,তোঁয়ারো বাড়ি হন্ডে,Toaro bari honde,আফনারার বাড়ি কই ,Afnarar baṛi koi
I don’t go to school.,আমি স্কুলে যাই না,Ami school e jai na,আঁই স্কুলত ন যাই,Añi schoolot no zai,আমি স্কুলো যাইতাম না,Ami skulo zaitam na
I won’t go.,আমি যাবো না,Ami jabo na,আঁই ন যাইয়্যুম,Añi no zaiyyum,আমি যাইতাম না,Ami zaitam na
I didn’t go to school.,আমি স্কুলে যাই নি,Ami school e jai ni,ইয়ান গেলদে হালিয়ে গইজ্জি,Ian gelde halie goijji,আমি স্কুলো গেছি না ,Ami skulo gesi na
I told you to leave from here.,তোমাকে এইখান থেকে যেতে বলেছি ,Tomake eikhan theke jete bolechi,তোয়ারে এইতুন যাইতামগো হইদি ,Toyare eitun zaitamgo hoidi,তোমারে ওখান থাকি যাইতে কইছি,Tomare okhan thaki zaite koisi
Told to leave from here.,এইখান থেকে যেতে বলেছি,Eikhan theke jete bolechi,এইতুন যাইতামগো হইদি ,Eitun zaitamgo hoidi,ওখান থাকি যাইতে কইছি,Okhan thaki zaite koisi
What do you do?,তুমি কি কাজ করো?,Tumi ki kaaj koro?,তুমি কি কাম গরতে লাইগ?,Tumi ki kam gorte laig?,তুমি কিতা কাজ করো ?,Tumi kita kaz koro?
What do you do?, কি কাজ করো?,Ki kaaj koro?,কি কাম গরতে লাইগ?,Ki kam gorte laig?,কিতা কাজ করো ?,Kita kaz koro?
Do you work?,কাজ করো?,Kaaj koro?,গরতে লাইগ?,Gorte laig?,কাজ করো?,Kaz koro?
Talk less?,কথা কম বলো?,Kotha kom bolo?,কথা হম হইস ,Hotha hom hois,মাত থোরা কইন?,Mat thora koin?
Do this work?,এই কাজটা করো?,Ei kaajta koro?,এই হাম্মান গড়ে দেও?,Ei hamman gore deo?,এই কাজটা করো?,Ei kazṭa koro?
Do the work.,কাজটা করো,Kaajta koro,হাম্মান গড়ে দেও,Hamman gore deo,কাজটা করো,Kazṭa koro
Do work in the morning.,সকালবেলা কাজ করো,Shokalbela kaaj koro,বেইন্নে গরতে লাইগ,Beinne gorte laig,বিয়ানবালা কাজ করো,Bianbala kaz koro
Work in the evening.,সন্ধ্যা কাজ করো,Shondha kaaj koro,হাজুইন্নে গরতে লাইগ,Hazuinne gorte laig,হাইঞ্জাবালা কাজ করো,Hainzabala kaz koro
I will slap you on one cheek.,এক গালে একটা থাপ্পর লাগিয়ে দিব ,Ek gaale ekta thappor lagiye dibo,অজ্ঞ গাল সায় সুয়ার দিউম,Oggo gal say suar dium,এক গালো একটা ছড় লাগাইয়া দিমু,Ek galo ekṭa soṛ lagaiya dimu
I will slap you.,একটা থাপ্পর লাগিয়ে দিব ,Ekta thappor lagiye dibo,সায় সুয়ার দিউম,Say suar dium,একটা ছড় লাগাইয়া দিমু ,Ekṭa soṛ lagaiya dimu
I will eat rice.,আমি ভাত খাব,Ami bhat khabo,আই ভাত খাইয়ুম ,Ai bhat haiyum,আমি ভাত খাইতাম ,Ami bat khaitam
Will eat rice.,ভাত খাব,Bhat khabo,ভাত খাইয়ুম ,Bhat haiyum,ভাত খাইতাম ,Bat khaitam
I have work.,আমার কাজ আছে,Amar kaaj ache,আর কাম আছে,Ar kam ase,আমার কাম আছে ,Amar kam ase
Have work.,কাজ আছে,Kaaj ache,কাম আছে,Kam ase,কাম আছে ,Kam ase
We will go.,আমরা যাইব,Amra jaibo,আরা যাইয়ুম ,Ara zaiyum,আমরা যাইমু ,Amra zaimu
What is your name?,তোমার নাম কী?,Tomar naam ki?,তোঁয়ার নাম কী?,Toar nam ki?,তোমার নাম কিতা ,Tomar nam kita
My name is Noyon.,আমার নাম নয়ন।,Amar naam Noyon.,আঁর নাম নয়ন।,Añr nam Noyon.,আমার নাম নয়ন।,Amar nam noyon.
I love you.,আমি তোমাকে ভালবাসি,Ami tomake bhalobashi,আঁত্তে তোঁয়ারে ভালা লাগে,Añtte toyare bhala lage,আমি তোমারে ভালাপাই ,Ami tomare balapai
Love you.,তোমাকে ভালবাসি,Tomake bhalobashi,তোঁয়ারে ভালা লাগে,Toyare bhala lage,তোমারে ভালাপাই ,Tomare balapai
Where are you going?,তুমি কোথায় যাচ্ছ?,Tumi kothay jaccho?,তুঁই কডে য‌অর?,Tui kode zor?,তুমি কই যাইরায়,Tumi koi zairay
Where are you going?,কোথায় যাচ্ছ?,Kothay jaccho?,কডে য‌অর?,Kode zor?,কই যাইরায়,Koi zairay
What should I bring?,কি আনব,Ki anbo,কী আইন্নুম,Ki ainnum,কিতা আনতাম ,Kita antam
"The baby is crying, feed him.","বাচ্চা কাঁদছে, খাবার খাওয়াও","Baccha kadche, khabar khawao","ফুয়া হান্দের, বচ্চু হাবাই দ","Fua hander, bossu habai do","ফুরুত্তা কান্দের, খানি খাওয়াও ","Furutta kander, khani khaowao"
I eat.,আমি খাই,Ami khai, আই হাই ,Ai hai,আমি খাই,Ami khai
I play.,আমি খেলি,Ami kheli,আই খেলি,Ai heli,আমি খেলি,Ami kheli
I will eat.,আমি খাব,Ami khabo,আই হাইয়ুম,Ai haiyum,আমি খাইমু ,Ami khaimu
I study.,আমি পড়ি ,Ami pori,আই ফড়ি,Ai fori,আমি পড়রাম ,Ami foṛram
I will study.,আমি পড়বো ,Ami porbo,আই ফৈরজুম ,Ai foirjum,আমি পড়মু ,Ami foṛmu
I will go to school.,আমি স্কুলে যাব,Ami school e jabo,আই স্কুলোত জিয়ুম,Ai schoolot ziyum,আমি স্কুলো যাইমু ,Ami skulo zaimu
Will go to school.,স্কুলে যাব,School e jabo,স্কুলোত জাইয়ুম,Schoolot zaiyum,স্কুলো যাইমু ,Skulo zaimu
I won’t eat rice.,আমি ভাত খাবো না,Ami bhat khabo na,আই ভাত খাইতম্ন,Ai bhat haitomno,আমি ভাত খাইতাম না ,Ami bat khaitam na
Won’t eat.,খাবো না,Khabo na,ভাত খাইতম্ন,Bhat haitomno,খাইতাম না ,Khaitam na
What do you do?,তুমি কি করো,Tumi ki koro,তুয়ায় কিত্ত্যালাখগু দে,Tuay kittalakhgu de,তুমি কিতা করো,Tumi kita koro
What do you do?,কি করো,Ki koro,কিত্ত্যালাখগু দে,Kittalakhgu de,কিতা করো ,Kita koro
I play games.,আমি খেলা করি,Ami khela kori,আই খেলা হাই,Ai hela hai,আমি খেলা কররাম ,Ami khela korram
Play games.,খেলা করি,Khela kori,খেলা হাই,Hela hai,খেলা কররাম ,Khela korram
Did you eat rice?,তুমি ভাত খেয়েছো ,Tumi bhat kheyecho,তুয়াই ভাত হাইউনা,Tuai bhat haiuna,তুমি ভাত খাইছো ,Tumi bat khaiso
How are you?,কি খবর তোমার,Ki khobor tomar,কি হবর তুয়ার,Ki hobor tuar,কিতা খবর তোমার ,Kita khobor tomar
What’s up?,কি খবর,Ki khobor,কি হবর,Ki hobor,কিতা খবর ,Kita khobor
Where is your home?,তোমাদের বাড়ি কোথায় ,Tomader bari kothay,তুয়ারও বাড়ি হন্ডে,Tuaro bari honde,তোমরার বাড়ি কই ,Tomrar baṛi koi
Where is home?,বাড়ি কোথায় ,Bari kothay,বাড়ি হন্ডে,Bari honde,বাড়ি কই ,Baṛi koi
What is everyone doing?,কি করো সবাই,Ki koro shobai,বিআগগুন কিত্তালাগগু,Biaggun kittalaggo,কিতা করো হ্ক্কলে ,Kita koro hkkole
What do you do?,কি করো,Ki koro,কিত্তালাগগু,Kittalaggo,কিতা করো,Kita koro
I will come by rickshaw.,আমি রিক্সা করে আসবো ,Ami rickshaw kore ashbo,আই রিক্সাত গড়ি আইসসুম,Ai riksat gori aissum,আমি রিক্সা দিয়া আইমু,Ami riksha diya aimu
Will come by rickshaw.,রিক্সা করে আসবো ,Rickshaw kore ashbo,রিক্সাত গড়ি আইসসুম,Riksat gori aissum,রিক্সা দিয়া আইমু ,Riksha diya aimu
My name is Arif.,আমার নাম আরিফ,Amar naam Arif,আর নাম আরিফ,Ar nam Arif,আমার নাম আরিফ,Amar nam Arif
What do you do?,তুমি কি কর,Tumi ki kor,তুই কি গরো ,Tui ki goro,তুমি কিতা কর,Tumi kita kor
What do you do?,কি কর,Ki kor,কি গরো ,Ki goro,কিতা কর,Kita kor
How old are you?,তোমার বয়স কত,Tomar boyosh koto,তুয়ার বয়স হতো,Tuar boyosh hoto,তোমার বয়স কত ,Tomar boyosh koto
Not good.,না ভাল নাই,Na bhalo nai,না ভালা নাই,Na bhala nai,না ভালা নাই,Na bala nai
I am angry.,আমি রাগ করেছি,Ami raag korechi,আই গোসসা গইজ্জি,Ai gossa goijji,আমি ঘুষা করছি ,Ami gusha korsi
I will talk to you later.,আমি তোমার সাথে পরে কথা বলব,Ami tomar shathe pore kotha bolbo,ফরে হতা কইয়ুম,Fore hota koiyum,আমি তোমার লগে পরে কথা কইমু,Ami tomar loge fore kotha koimu
This house is ours.,এই বাড়িটা আমাদের,Ei barita amader,বারি ইবে আঁরার,Bari ibe Añrar,ওউ বাড়ি আমরার ,Ou baṛi amrar
Sit nicely.,সুন্দর ভাবে বস,Shundor bhabe bosho,তুই উওফারি বয়,Tui uofari boy,সুন্দর করিয়া বও ,Shundor koriya bo
No one came to our house.,আমাদের বাড়িতে কেউ আসে নাই,Amader barite keu ashe nai,আঁরো বারিত কনো কিয়া নো আইয়ি,Añro barit kono kiya no aiyi,আমরা বাড়িত কেউ আইছে না ,Amra baṛit keu aise na
What are you doing?,কী করছেন,Ki korchen,কি গইত্ত্যু লাইগ্গুন,Ki goittyu laiggun,কিতা কররায়,Kita korray
"Brother, what are you doing?",ভাই/ভাইয়া কী করছেন?,Bhai/Bhaiya ki korchen?,বদ্দা কি গইত্ত্যু লাইগ্গ্যুন?,Bodda ki goittyu laiggun?,ভাই কিতা কররায়,Bai kita korray
"Can’t do it, high fever.",করতে পারতেছি না অনেক জর,Korte partechi na onek jor,গরিন্নফারির বউত জর,Gorinnofarir bout jor,করতাম পাররাম না বহুত জ্বর ,Kortam parram na bohut zor
I like apples.,আপেল আমার  পছন্দ,Apple amar pochondo,আফেল আঁত্তে মঅব্বত,Afel Añtte moobbot,আপেল আমার পছন্দ ,Afel amar posondo
I like grapes.,আঙ্গুর  আমার  পছন্দ,Angur amar pochondo,আনকুর আঁত্তে মঅব্বত,Ankur Añtte moobbot,আঙ্গুর আমার পছন্দ ,Angur amar posondo
He eats a lot.,সে অনেক খায় ,Se onek khay,ইতে যে হানা হায় ,Ite ye hana hay,হে অনেক খায়,He onek khay
What did I do?,আমি কি করলাম?,Ami ki korlam?,আই কিচ্চি?,Ai kissi?,আমি কিতা করছি ,Ami kita korsi
Will go out today.,আজকে বাহিরে যাব,Ajke bahire jabo,আজিয়া বাআরকুলে যাইয়ুম ,Aziya baarkule zaiyum,আজকে বাইরে যাইমু,Azke baire zaimu
Won’t go out today.,আজকে বাহিরে যাব না,Ajke bahire jabo na,আইদ্দে হালিয়া বাআরকুলে নযাইয়ুম ,Aidde haliya baarkule nozaiyum,আজকে বাইরে যাইতাম নায়,Azke baire zaitam nay
Tell me the truth.,আমাকে সত্যি কথা বলুন,Amake shotti kotha bolun,আরে হাছা হতা হয়ডো ,Are hasa hota hoydo,আমারে হাছা কথা কৌকা,Amare hasa kotha kouka
Tell the truth.,সত্যি কথা বলুন,Shotti kotha bolun,হাছা হতা হয়ডো ,Hasa hota hoydo,হাছা কথা কৌকা,Hasa kotha kouka
Speak.,কথা বলুন,Kotha bolun,হতা হয়ডো ,Hota hoydo,কথা কৌকা,Kotha kouka
